{
  "title": "Idropulitrice 3000 W",
  "body": "Idropulitrice a rete con pistola a pressione regolabile, display LCD e tubo ad alta pressione da 10 m con avvolgitubo. Sono inclusi un ugello 3 in 1, un ugello turbo e un accessorio lavasuperfici.",
  "evidence": "",
  "_sourceHash": "1f4b7ae347e2fc374b32c5ad180c0e55ababcd2e03330b9567953ef388f68557",
  "specifications": {
    "Weight": "21,6 kg",
    "Maximum inlet pressure": "0,8 MPa (8 bar)",
    "Maximum suction height": "0,5 m"
  }
}
