{
  "title": "Sega a gattuccio a batteria 20 V",
  "body": "Sega a gattuccio per tagliare materiali adatti con lame intercambiabili.",
  "evidence": "Produttore: Kompernass Handels GmbH. Dichiarazione di conformità, pagina PDF 16; IAN 310954.",
  "_sourceHash": "999aaf72e6d3ec6edad53dac4e321d9f8ecaa7cc9237f8459f5cd9bbe5ba6854"
}
