{
  "title": "Trapano avvitatore a percussione a batteria 20 V",
  "body": "Trapano con percussione per forare materiali adatti e avvitare.",
  "evidence": "Produttore: Kompernass Handels GmbH. Dichiarazione di conformità, pagina PDF 15; IAN 315627.",
  "_sourceHash": "78df00bb13ae4bcf104e03fdc6113f79077644761462ef06c7054312048c767c"
}
