{
  "title": "Avvitatore a impulsi a batteria 20 V",
  "body": "Avvitatore a impulsi per serrare e allentare dadi e bulloni.",
  "evidence": "Produttore: Kompernass Handels GmbH. Dichiarazione di conformità, pagina PDF 15; IAN 309644.",
  "_sourceHash": "e2876838a376dd0ccef105b08b1cc68cd664dab0557bb58b20fac2621dc086ed"
}
