{
  "title": "Utensile rotativo a batteria 12 V",
  "body": "Utensile rotativo per smerigliatura fine, levigatura e altri lavori con accessori adatti.",
  "evidence": "Produttore: Kompernass Handels GmbH. Dichiarazione di conformità, pagina PDF 23; IAN 390411.",
  "_sourceHash": "dacba8f52747a2fbe2cb4b2eb86253b1e0a3bd89fa4663209e07a0f9a33c2103"
}
