{
  "title": "Stazione ad aria calda e saldatura",
  "body": "Stazione che combina lavorazioni ad aria calda e saldatore.",
  "evidence": "Produttore: Kompernass Handels GmbH. Dichiarazione di conformità, pagina PDF 15; IAN 458701.",
  "_sourceHash": "31d1097a2d87a9f2f7e1dcbe37d11235cea07302b97481987d5b31e2daafdd34"
}
