{
  "title": "Sparapunti e chiodatrice a batteria 20 V",
  "body": "Utensile di fissaggio per inserire graffe o chiodi in materiali adatti.",
  "evidence": "Produttore: Kompernass Handels GmbH. Dichiarazione di conformità, pagina PDF 17; IAN 373432.",
  "_sourceHash": "754d4123cadf03172459763959fdcf59dc208c2a3d10c9f4027f5ca5b4d4134d"
}
