{
  "title": "Trapano avvitatore a batteria 12 V",
  "body": "Trapano avvitatore per eseguire fori e avvitare. Dispone di regolazione della velocità.",
  "evidence": "Produttore: Kompernass Handels GmbH. Dichiarazione di conformità, pagina PDF 15; IAN 288023.",
  "_sourceHash": "7eb242436fd8133c780bfd3aefa1f83d654189b80dbd4487783fac60b6925e94"
}
