{
  "title": "Sega a immersione a batteria 20 V",
  "body": "Sega a immersione per tagli diritti e a tuffo controllati in materiali adatti.",
  "evidence": "Produttore: Kompernass Handels GmbH. Dichiarazione di conformità, pagina PDF 43; IAN 308610.",
  "_sourceHash": "8c4a61f3e648bfe2c8df78944f7fe93a00ccab9fa7cd4ced1df54391f5b7ef0b"
}
