{
  "title": "Set trapano avvitatore ricaricabile, 80 Nm",
  "body": "Utensile per lavori di foratura e avvitamento.",
  "_sourceHash": "5eb1224b287e280ac81192b5788a929e376c69f0e6b63bce6231b816c493ca80",
  "evidence": "Dichiarazione UE di conformità, pagina PDF 39, rilasciata da Grizzly Tools GmbH & Co. KG per PPBSSA 12 A1; IAN 477958_2401."
}
