{
  "title": "Trapano avvitatore a batteria 20 V",
  "body": "Trapano avvitatore per eseguire fori e avvitare.",
  "evidence": "Modello e IAN riportati nella scheda prodotto ufficiale Kompernass per l’IAN 338733.",
  "_sourceHash": "f99404c1d3d60596117eb5298f1fa4a876aaaab227445b303ab4f99661dd081c"
}
