{
  "title": "Avvitatore ricaricabile a batteria 4 V",
  "body": "Avvitatore ricaricabile per inserire e rimuovere viti.",
  "evidence": "Modello e IAN riportati nella scheda prodotto ufficiale Kompernass per l’IAN 317136.",
  "_sourceHash": "c8efb61b64d6f2ad47dcfef2c747df0799dcb385349271a036e5079942d102e2"
}
