{
  "title": "Pompa per pozzo profondo",
  "body": "Pompa per pozzo profondo.",
  "_sourceHash": "801d75c82b56c56fbe21b58bc4df8556ea00ea5911b6b626a919d478df48e7a8",
  "evidence": "Produttore: OWIM GmbH & Co. KG. Dichiarazione di conformità, pagina PDF 31; IAN 403782.",
  "specifications": {
    "Weight": "11 kg (accessori inclusi)"
  }
}
