{
  "title": "Sparapunti e chiodatrice",
  "body": "Utensile di fissaggio per inserire graffe o chiodi in materiali adatti.",
  "evidence": "Produttore: Kompernass Handels GmbH. Dichiarazione di conformità, pagina PDF 16; IAN 423081.",
  "_sourceHash": "a9e1fce53c6a702c12e48efef45da7f4d06f398e06b457985e8dfcf4edd7ea23"
}
