{
  "title": "Martello demolitore",
  "body": "Martello demolitore per scalpellare e demolire la muratura.",
  "evidence": "Produttore: Kompernass Handels GmbH. Dichiarazione di conformità, pagina PDF 12; IAN 300553.",
  "_sourceHash": "5cdd0e94714ec04fc612ad0a265e93f7dd173ee7b07498e0eed14450b29fa207"
}
