{
  "title": "Pistola per colla a caldo",
  "body": "Pistola per incollare materiali adatti con stick di colla a caldo.",
  "evidence": "Modello e IAN riportati nella scheda prodotto ufficiale Kompernass per l’IAN 297286.",
  "_sourceHash": "fc47f3b73f324c0874f985db150213ff5816743a665e8ad4c3336e4e3b6f3c0a"
}
