{
  "title": "Smerigliatrice diritta e troncatrice pneumatiche",
  "body": "Smerigliatrice e troncatrice pneumatiche offerte con lo stesso IAN.",
  "evidence": "Modello e IAN riportati nella scheda prodotto ufficiale Kompernass per l’IAN 356007.",
  "_sourceHash": "2dc5771195fb728ac39d25436f10cab178134726c14d5473be459675e43c9ed7"
}
