{
  "title": "Tagliasiepi a braccio lungo",
  "body": "Tagliasiepi per la manutenzione delle siepi.",
  "_sourceHash": "c7d49f8153a716d0db4fddd52720cbb7d8c8f44eb0a75ddc6446c8d03b786eb2",
  "evidence": "Dichiarazione UE di conformità, pagina PDF 18; IAN 478549.",
  "specifications": {
    "Weight including accessories": "Circa 4.9 kg"
  }
}
