{
  "_sourceHash": "d9953ea776367e8d67095469a9c54078c101ec3a3af28fe628fe453329034872",
  "title": "Aspiratore solidi e liquidi",
  "body": "Aspiratore per la raccolta di detriti solidi e liquidi.",
  "evidence": "Produttore: Grizzly Tools GmbH & Co. KG. Dichiarazione di conformità, pagina PDF 46; IAN 322475."
}
