{
  "title": "Utensile multifunzione oscillante",
  "body": "Utensile multifunzione oscillante per tagliare, raschiare e levigare con accessori adatti.",
  "evidence": "Modello e IAN riportati nella scheda prodotto ufficiale Kompernass per l’IAN 270411.",
  "_sourceHash": "8a81dbcf1a7afde1519affc7a33370acb45c116d8d36dea8fb65d05ef9230b74"
}
