{
  "title": "Seghetto alternativo a batteria 20 V",
  "body": "Seghetto alternativo per tagli diritti e curvi in materiali adatti. Un raccordo consente di collegare un sistema di aspirazione esterno.",
  "evidence": "Produttore: Kompernass Handels GmbH. Dichiarazione di conformità, pagina PDF 27; IAN 302616.",
  "_sourceHash": "344c35c5b3ee8ab4ddc7598a7bd6eafd253f888f3cbc35f5fd8bebcd2e036cde"
}
