{
  "title": "Avvitatore ricaricabile a batteria 4 V",
  "body": "Avvitatore ricaricabile per inserire e rimuovere viti.",
  "evidence": "Produttore: Kompernass Handels GmbH. Dichiarazione di conformità, pagina PDF 53; IAN 332948.",
  "_sourceHash": "b2017920f1d88d60f7088ab9dc14f03a5766b0d032a05c80aa6364e73a018bb5"
}
